title,artist,lyrics
"Sozinho","Caetano Veloso","Às vezes, no silêncio da noite
Eu fico imaginando nós dois
Eu fico ali sonhando acordado
Juntando o antes, o agora e o depois

Por que você me deixa tão solto?
Por que você não cola em mim?
Tô me sentindo muito sozinho

Não sou nem quero ser o seu dono
É que um carinho, às vezes, cai bem
Eu tenho os meus desejos e planos secretos
Só abro pra você, mais ninguém

Por que você me esquece e some?
E se eu me interessar por alguém?
E se ela, de repente, me ganha?

Quando a gente gosta
É claro que a gente cuida
Fala que me ama
Só que é da boca pra fora

Ou você me engana
Ou não está madura
Onde está você agora?

Quando a gente gosta
É claro que a gente cuida
Fala que me ama
Só que é da boca pra fora

Ou você me engana
Ou não está madura
Onde está você agora?"
"Mina de Fé","Os Morenos","Eu era feliz sem saber
Êh! Êh!
Isso me revolta
Tudo que eu fiz
Foi sem querer
Êh! Êh!
Será que tem volta

Eu não dei valor
Não me dediquei
Ao meu grande amor
Como eu vacilei
Tô doente de saudade

Tanta curtição
Tanta liberdade
Quanta azaração
Quanta falsidade
Tô doente de saudade

Eu aprendi
Não vale nada
Noite, farra, madrugada
Eu prometi não te magoar
Pode confiar

Foi preciso perder
Pra aprender a valorizar
A mina de fé, a mina de fé
Eu preciso entender
Não se deve largar jamais
A mina de fé, a mina de fé

Eu era feliz sem saber
Êh! Êh!
Isso me revolta
Tudo que eu fiz
Foi sem querer
Êh! Êh!
Será que tem volta

Eu não dei valor
Não me dediquei
Ao meu grande amor
Como eu vacilei
Tô doente de saudade

Tanta curtição
Tanta liberdade
Quanta azaração
Quanta falsidade
Tô doente de saudade

Eu aprendi
Não vale nada
Noite, farra, madrugada
Eu prometi não te magoar
Pode confiar

Foi preciso perder
Pra aprender a valorizar
A mina de fé, a mina de fé
Eu preciso entender
Não se deve largar jamais
A mina de fé, a mina de fé"
"Pra Falar A Verdade","Daniel","Um amigo me falou
Que a poeira vai baixar
Que qualquer carinho novo
Põe as coisas no lugar

Que essa falta de você
Tende a desaparecer
E a distância faz a gente esquecer

Que o amargo e a solidão
Que me corta o coração
De repente vão embora
Que é chuva de verão

Que esse pranto vai secar
E eu vou me acostumar
Que a tempestade logo vai passar

Pra falar a verdade
Na realidade
É que pra você o nosso amor desencantou

Só que no meu caso
Saiu tudo errado
Se o tempo apaga dessa vez não apagou

Pra falar a verdade
Na realidade
É que pra você o nosso amor desencantou

Só que no meu caso
Saiu tudo errado
Se o tempo apaga dessa vez não apagou

Que o amargo e a solidão
Que me corta o coração
De repente vão embora
Que é chuva de verão

Que esse pranto vai secar
E eu vou me acostumar
Que a tempestade logo vai passar

Pra falar a verdade
Na realidade
É que pra você o nosso amor desencantou

Só que no meu caso
Saiu tudo errado
Se o tempo apaga dessa vez não apagou

Pra falar a verdade (falar a verdade)
Na realidade (na realidade)
É que pra você o nosso amor desencantou

Só que no meu caso (só que no meu caso)
Saiu tudo errado (saiu tudo errado)
Se o tempo apaga dessa vez não apagou

Pra falar a verdade (falar a verdade)
Na realidade (na realidade)
É que pra você o nosso amor desencantou

Só que no meu caso (só que no meu caso)
Saiu tudo errado (saiu tudo errado)
Se o tempo apaga dessa vez não apagou"
"Me apaixonei pela pessoa errada","Exaltasamba","Eu não tenho culpa de estar te amando
De ficar pensando em você toda hora
Não entendo por que deixei acontecer
E isso tudo me apavora

Você não tem culpa se eu estou sofrendo
Se fantasiei de verde esta história
Você tem namorado, posso até estar errado
Mas tenho que ganhar você

É mais do que desejo, é muito mais do que amor
Eu te vejo nos meus sonhos
E isso aumenta mais a minha dor

Eu me apaixonei pela pessoa errada
Ninguém sabe o quanto que estou sofrendo
Sempre que eu vejo ele do seu lado
Morro de ciúmes, estou enlouquecendo

(Eu me apaixonei pela pessoa errada)
(Ninguém sabe o quanto que estou sofrendo)
(Sempre que eu vejo ele do seu lado)
(Morro de ciúmes, estou enlouquecendo)

Fica comigo, me deixa ao menos te tocar
Entenda que ao meu lado é o seu lugar

Eu me apaixonei pela pessoa errada
Ninguém sabe o quanto que estou sofrendo
Sempre que eu vejo ele do seu lado
Morro de ciúme, estou enlouquecendo

(Eu me apaixonei pela pessoa errada)
(Ninguém sabe o quanto que estou sofrendo)
(Sempre que eu vejo ele do seu lado)
(Morro de ciúme, estou enlouquecendo)

Fica comigo, vai
Eu morro de ciúmes quando vejo ele do seu lado
Assim não dá

Eu não tenho culpa de estar te amando
De ficar pensando em você toda hora
Não entendo por que deixei acontecer
Isso tudo me apavora

Você não tem culpa se eu estou sofrendo
Se fantasiei de verde essa história
Você tem namorado, posso até estar errado
Mas tenho que ganhar você

É mais do que desejo, é muito mais do que amor
Eu te vejo nos meus sonhos
E isso aumenta mais a minha dor

Eu me apaixonei pela pessoa errada
Ninguém sabe o quanto que estou sofrendo
Sempre que eu vejo ele do seu lado
Morro de ciúmes, estou enlouquecendo

(Eu me apaixonei pela pessoa errada)
(Ninguém sabe o quanto que estou sofrendo)
(Sempre que eu vejo ele do seu lado)
(Morro de ciúmes, estou enlouquecendo)

(Eu me apaixonei pela pessoa errada)
(Ninguém sabe o quanto que estou sofrendo)
(Sempre que eu)"
"Nunca Vou Deixar Você","Karametade","Não mudou nada em mim
Tenho os mesmos amigos
As mesmas manias
Eu não troco de time
Nem santo, nem guias
Sou fiel até mesmo
Ao fazer fantasias

Meu coração é assim
Só quer o teu amor
Pular a cerca, eu pulei
Mas só você eu amei
Errar, eu já errei
Mas pra você eu voltei
Transar eu já transei
Mas com você que eu fiquei

Você é quem manda no meu coração
Você é quem acende o fogo da paixão
Quem é que dá show na hora de amar
E sabe fazer meu corpo delirar?

Você põe verdade na minha ilusão
É minha loucura, é minha tentação
Você dá um show na hora do prazer
Por isso é que eu nunca vou deixar você"
"Dois Corações e Uma História","Zezé Di Camargo & Luciano","No meio da conversa
De um caso terminando
Um fala, o outro escuta
Os olhos vão chorando

A lógica de tudo
É o desamor que chega
Depois que um descobre
Que o outro não se entrega

Quem vai sair arruma
As coisas põe na mala
Enquanto o outro fuma
Um cigarro na sala

E o coração palhaço
Começa a bater forte
Quem fica não deseja
Que o outro tenha sorte

E longe um do outro
A vida é toda errada
O homem não se importa
Com a roupa amarrotada

E a mulher em crise
Quantas vezes chora
A dor de ter perdido
Um grande amor que foi embora

Mas quando vem a volta
O homem se arruma
Faz barba, lava o carro
Se banha, se perfuma

E liga pro amigo
Que tanto lhe deu força
E jura nunca mais
Vai perder essa moça

E a mulher se abraça
À sua mãe diz: Obrigado!
E põe aquela roupa
Que agrada o seu amado

E passa a tarde toda
Cuidando da beleza
Jantar à luz de velas
E amor de sobremesa

E perto um do outro
A vida é diferente
A solidão dá espaço
Ao amor que estava ausente

Quem olha, não tem jeito
De duvidar agora
Da força da paixão que tem
Dois corações e uma história

E perto um do outro
A vida é diferente
A solidão dá espaço
Ao amor que estava ausente

Quem olha, não tem jeito
De duvidar agora
Da força da paixão que tem
Dois corações e uma história"
"Cachorrada","Gabriel o Pensador","Sou um vira-lata e tô afim daquela gata responsa
Que parece uma onça
Ela é de raça, não é nenhuma gata vadia
E quando ela passa o meu pelo se arrepia

Ela mia, miau! E eu passo mau
Eu não sou gato, eu só lato: Au! Au!
Algum tagarela me falou que ela é donzela
Que é melhor eu desistir e procurar uma cadela

Eu disse: É ruim, animal, de cachorra eu tô legal
A última que tive me trocou por um chow-chow
É tudo igual
Jeitinho de santa cara-de-pau
E quando ficam no cio fazem até bacanal

Eu tô afim de uma gata
Mas só tem cachorra

Eu tô afim de uma gata
Mas só acho canina, vou soltar os cachorro em cima

Eu já rezei pra são bernardo pra conquistar esse amor
E até procurei um pastor
Mas eu não entendi a oração que o o pastor me passou
Porque o pastor era pastor alemão e eu só sei latir em português
Estou me sentindo um pequinês

Uh! Uh! Uh! Um conselho, deixa a gata pra lá
Você só vai arrumar sarna pra se coçar
Ela é muita ração pra sua tigela
Ela mora na mansão, você mora na favela
Ela come só salmão, tu nem pão com mortadela
Ela torce pro palmeiras, tu é timão
Ela é mangueira e tu portela

E tu é cão vira-lata, ela é gata, esquece
Que eu te apresento uma poodle mais bonita que a lassie

Au, au, alto lá só por que você foi adestrado tá querendo me ensinar?
Eu conheço a tua raça, quer meter o focinho onde não foi chamado?
Passa, passa, passa, que eu não sou pitt-bull mas tô ficando nervoso
Avisa pra gata que ela vai ter um esposo
Que é um vira-lata teimoso
Eu não sou nenhum dálmata, mas também sou pintoso

Eu tô afim de uma gata
Mas só tem cachorra
Eu tô afim de uma gata
Mas só acho canina, vou soltar os cachorro em cima

E ai vira-lata
Fala, fila
Num se finge de morto, não, não vacila aí!
Aquele gato ali tá afim da tua gata
E falou que vai na pata com você
Quero ver, vai lá, mete o canino na orelha do felino
Dá-lhe uma dentada feito tyson atacando rollyfield
Quebra esse garfield na porrada
Aí qualé da parada?
Aí, não vai fazer nada?

Calma aí, sem briga
Eu quebro esse mané só na ideia, se liga
Escuta aqui, seu projeto de tamborim
Eu não tô falando grego, nem latindo em latim
Eu tô a fim daquela gata e tô sabendo que tu quer levar uns tapas na lata
Mas não vô perder meu tempo com muleque brigão
Que não tem nada na cabeça e tira onda de machão
Tá querendo se atracar comigo
Num rola
Vai atrás do piu piu, frajola

Eu tô afim de uma gata
Mas só tem cachorra
Eu tô afim de uma gata
Mas só acho canina, vou soltar os cachorro em cima

Tá cheio de hotweiler
Cercando a casa dela mas eu tô entrando pela janela
Pareço até um gato, mas não mio, nem arranho
Au! Ela tá tomando banho
Oi, minha deusa felina
Gostei desse banho de língua, cê me ensina?
Que é isso, cachorro, me solta
Calma, gatinha, vamo dar uma volta

Fica tranquila, que eu não vou te morder
Encolhe as suas unhas que eu te levo pra ver
O filmaço que eu assisto todo dia
O frango que roda lá na padaria
Vamô! Foge da mansão
E venha conhecer a minha vida de cão
Que tem mais emoção

Eu tô afim de uma gata
Mas só tem cachorra
Eu tô afim de uma gata
Mas só acho canina, vou soltar os cachorro em cima

Bora, gatinha! Cola na minha
Pega
Ih, babô! A carrocinha
Au, au, algemaram meu pescoço
Onde já se viu, me trancaram num canil
Se eu tivesse pedigree, eu duvido que eu tivesse aqui
Pagando por um crime que eu não cometi
Eu não sou lobo e a gata não é ovelha
Mas eu também não sou bobo e tô com a pulga atrás da orelha
Com esse cão policial que fica rindo de mim
Tá bancando o rintintin
Mas perece o rabugento
Me tira daqui
Eu não tenho sete vidas
Preciso aproveitar o meu tempo

Eu tô afim de uma gata
Mas só tem cachorra
Eu tô afim de uma gata
Mas só acho canina, vou soltar os cachorro em cima

Agora eu tô na boa
A gata me tirou do canil
E pediu pra ser minha patroa
Eu nunca fui de baderna
Mas também não saio com o rabo entre as pernas
Bicho solto
O meu dono é liberdade
Osso duro de roer
Pra roer com vontade
É o bicho
Quem se empenha chega lá
A gatinha tá prenha
Vamo ver que bicho dá

Eu tô afim de uma gata
Mas só tem cachorro
Eu não sou um cão de raça da exposição
Mas eu sou um vira-lata com disposição"
"Vai dar Samba","Daniel","Gosto, e isso não é nenhum segredo
Quero te namorar
Gosto, gosto de você faz muito tempo
E como é gostoso gostar

Ando junto com você qualquer caminho
Sonho bom, de viver
Quando, você se render aos meus carinhos
Não vai nem chorar nem sofrer

Tem coisas que a gente sente
No fundo do coração
Nós nascemos um pro outro
Diz a minha intuição
É a canoa e o rio, é a corda e a caçamba
Não tem erro, não dá outra, vai dar samba

Tem coisas que a gente sente
No fundo do coração
Nós nascemos um pro outro
Diz a minha intuição
É a canoa e o rio
É a corda e a caçamba
Não tem erro
Não dá outra
Vai dar samba

Tem coisas que a gente sente
No fundo do coração
Nós nascemos um pro outro
Diz a minha intuição
É a canoa e o rio
É a corda e a caçamba
Não tem erro
Não dá outra
Vai dar samba

Gosto, e isso não é nenhum segredo
Quero te namorar
Gosto, gosto de você faz muito tempo
E como é gostoso gostar

Ando junto com você qualquer caminho
Sonho bom de viver
Quando você se render aos meus carinhos
Não vai nem chorar nem sofrer

Tem coisas que a gente sente
No fundo do coração
Nós nascemos um pro outro
Diz a minha intuição
É a canoa e o rio
É a corda e a caçamba
Não tem erro
Não dá outra
Vai dar samba

Tem coisas que a gente sente
No fundo do coração
Nós nascemos um pro outro
Diz a minha intuição
É a canoa e o rio
É a corda e a caçamba
Não tem erro
Não dá outra
Vai dar samba"
"O Vento","Jota Quest","Voe por todo mar e volte aqui
Voe por todo mar e volte aqui
Pro meu peito

Se você for, vou te esperar
Com o pensamento que só fica em você

Aquele dia, um algo mais
Algo que eu não poderia prever
Você passou perto de mim
Sem que eu pudesse entender
Levou os meus sentidos todos pra você

Mudou a minha vida e mais
Pedi ao vento pra trazer você aqui
Morando nos meus sonhos e na minha memória
Pedi ao vento pra trazer você pra mim

O vento traz você de novo
O vento faz do meu mundo um novo
E voe por todo o mar e volte aqui
E voe por todo o mar e volte aqui
Pro meu peito"
"Não Foi à Toa","Soweto","Amor
Mais uma vez eu me atrasei
Eu sei, perdi a hora
No caminho me lembrei
Que essa noite é importante hoje faz um mês
Que os nossos olhos se olharam a primeira vez

Amor
Receba as flores que eu comprei
Na cor que você gosta
Foi difícil mas achei
Procurei pela cidade
Cheio de paixão

Se eu cheguei tarde o culpado é o meu coração
Eu já me justifiquei, não foi à toa
Me abraça meu amor, vai me perdoa

Te amo demais, não chego tarde nunca mais
Vem, vamos comemorar que a noite e nossa
Abre seu coração e tranque a porta
Te amo de mais"
"Pare","Zezé Di Camargo & Luciano","Pare
Até quando
Você quer mandar
E mudar minha vida?

Pare
Meus desejos
E suas vontades
Estão divididas

Solidão está matando a gente
Sufocando a nossa paixão
Então, pare
Liberta o meu coração

Se fosse uma ou duas vezes
Eu não ligaria
Ciúme e alguns defeitos
Todo mundo tem

Mas quando o amor machuca
E passa da conta
Fica como eu, querendo
Ficar sem ninguém

Se fosse falta de carinho
Eu entenderia
Mas todos os meus pensamentos
Foram pra você

Sozinho eu vi chegar a noite
Vi raiar o dia
Ir embora a alegria
Que eu tinha de viver

Um grande amor
Não faz assim
Você se esconde de você
Dentro de mim

Não é amor
Tente entender
De uma vez
Que eu não fui feito pra você"
"Tá Tudo Bem","Ivete Sangalo","Chegou e me levou como uma onda
Pintou e conquistou meu coração
Não consigo esquecer, aquele beijo na beira do mar,não
Sem o teu calor eu fico tonta
Não consigo suportar a solidão
Sou jardim sem flor, lua sem amor, não tem graça não
Esquece o que ficou pra trás
Deixa o que passou pra lá e vem, correndo pros meus braços
Falar de amor é fácil, difícil é enganar o coração

Liga pra mim, diga que vem
Faz um carinho, sou seu neném
Fala baixinho, no meu ouvidinho, tá tudo bem, tá tudo bem
Liga pra mim, diga que vem
Faz um carinho, sou seu neném
Fala baixinho, no meu ouvidinho, tá tudo bem, tá tudo bem

Chegou e me levou como uma onda
Pintou e conquistou meu coração
Não consigo esquecer, aquele beijo na beira do mar,não
Sem o seu calor eu fico tonta
Não consigo suportar a solidão
Sou jardim sem flor, lua sem amor, não tem graça não
Esquece o que ficou pra trás
Deixa o que passou pra lá e vem, correndo pros meus braços
Falar de amor é fácil, difícil é enganar o coração

Liga pra mim, diga que vem
Faz um carinho, sou seu neném
Fala baixinho, no meu ouvidinho, tá tudo bem, tá tudo bem
Liga pra mim, diga que vem
Faz um carinho, sou seu neném
Fala baixinho, no meu ouvidinho, tá tudo bem, tá tudo bem"
"Depois","Pato Fu","Não foi dessa vez
Mas pode ter certeza
Mal posso esperar
Pra fugir da tristeza

Amanhã talvez
Vai ser um carnaval
Vão falar de mim
Pro bem ou pro mal

Tomo um café
E um guaraná pra me animar
Mas ficou tão tarde
Que é melhor deixar pra lá (ah, ah, ah)

Quando penso em nós dois
Deixo tudo pra depois
Quando penso em nós três
Fica pra outra vez

Quando penso em nós dois
Deixo tudo pra depois
Quando penso em nós três
Fica pra outra vez

Juntei passos, palavras
Não era bem o momento
Finge não querer nada
Tem hora que não me aguento

Tomo um café
E um guaraná pra me animar
Mas ficou tão tarde
Que é melhor deixar pra lá (ah, ah, ah)

Quando penso em nós dois
Deixo tudo pra depois
Quando penso em nós três
Fica pra outra vez

Quando penso em nós dois
Deixo tudo pra depois
Quando penso em nós três
Fica pra outra vez

Prometo, juro, garanto
Vou resolver tudo isso
Assim que tiver coragem
E mais nenhum compromisso

Tomo um café
E um guaraná pra me animar
Mas ficou tão tarde
Que é melhor deixar pra lá (ah, ah, ah)

Quando penso em nós dois
Deixo tudo pra depois
Quando penso em nós três
Fica pra outra vez

Quando penso em nós dois
Deixo tudo pra depois
Quando penso em nós três
Fica pra outra vez

Quando penso em nós dois
Deixo tudo pra depois
Quando penso em nós três
Fica pra outra vez

Quando penso"
"Farol das estrelas","Soweto","Os teus olhos refletem nos meus
O farol das estrelas
Te procuro no azul dos meus sonhos
Para não perdê-la
Nossa cama é um porto de amor
Onde espero feliz pra revê-la
Toda linda e cheia de luz
Com o teu corpo de estrela

É tão bonito o amor que a gente faz
Tem tanta cor, tem tanta paz
Nos braços da estrela cadente
Como adolescente eu me dei
Se o brilho da nossa verdade
Durar para a eternidade
A estrela da felicidade encontrei

A primeira vez que eu te beijei
No céu da Cidade de Neon
Pulei nos teus braços, me joguei
Voei, voei
Voei de prazer no céu de anil
Contigo ao meu lado eu vou voar
Em qualquer lugar desse Brasil
Te amar, te amar

Os teus olhos refletem nos meus
O farol das estrelas
Te procuro no azul dos meus sonhos
Para não perdê-la
Nossa cama é um porto de amor
Onde espero feliz pra revê-la
Toda linda e cheia de luz
Com o teu corpo de estrela

É tão bonito o amor que a gente faz
Tem tanta cor, tem tanta paz
Nos braços da estrela cadente
Como adolescente eu me dei
Se o brilho da nossa verdade
Durar para a eternidade
A estrela da felicidade encontrei

A primeira vez que eu te beijei
No céu da Cidade de Neon
Pulei nos teus braços, me joguei
Voei, voei
Voei de prazer no céu de anil
Contigo ao meu lado eu vou voar
Em qualquer lugar desse Brasil
Te amar, te amar

A primeira vez que eu te beijei (que eu te beijei)
No céu da Cidade de Neon
Pulei nos teus braços, me joguei
Voei, voei
Voei de prazer no céu de anil (no céu de anil)
Contigo ao meu lado eu vou voar
Em qualquer lugar desse Brasil
Te amar, te amar

A primeira vez que eu te beijei (que eu te beijei)
No céu da Cidade de Neon (de Neon)
Pulei nos teus braços, me joguei
Voei, voei"
"120… 150… 200 Km, Por Hora","Leonardo","As coisas estão passando mais depressa
O ponteiro marca 120
O tempo diminui
As árvores passam como vultos

A vida passa, o tempo passa
Estou a 130, as imagens se confundem
Estou fugindo de mim mesmo
Fugindo do passado
Do meu mundo assombrado
De tristeza, de incerteza
Estou a 140, fugindo de você

Eu vou voando pela vida sem querer chegar
Nada vai mudar meu rumo, nem me fazer voltar
Vivo fugindo sem destino algum
Sigo caminhos que me levam a lugar nenhum
O ponteiro marca 150
Tudo passa ainda mais depressa
O amor, a felicidade, o vento afasta uma lágrima
Começa a rolar no meu rosto

Estou a 160, vou acender os faróis, já é noite
Agora são as luzes que passam por mim
Sinto um vazio imenso
Estou só na escuridão, a 180
Estou fugindo de você

Eu vou sem saber pra onde, nem quando vou parar
Não, não deixo marcas no caminho pra não saber voltar
Às vezes eu sinto que o mundo se esqueceu de mim
Não, não sei por quanto tempo ainda, eu vou viver assim

O ponteiro agora marca 190
Por um momento tive a sensação de ter você a meu lado
O banco está vazio, estou só, a 200 por hora
Vou parar de pensar em você e vou prestar atenção na estrada

Vou sem saber pra onde, nem quando vou parar
Não, não deixo marcas no caminho pra não saber voltar
Às vezes, às vezes sinto que o mundo se esqueceu de mim
Não, não sei por quanto tempo ainda, eu vou viver assim!"
"Quando a gente ama","Os Travessos","Não sei o que é que falta pra esse amor dar certo
Será que eu errei em te agradar demais?
Eu acho que você não gosta muito disso
Alguém que só te ama não te satisfaz

Amar como eu te amo até que eu não queria
Mas o que eu vou fazer se não tem solução?
Brincar com quem te gosta assim é covardia
Faz bem só pro seu ego e mal pro coração
(Faz bem só pro seu ego e mal pro meu coração)

Laia laia laia, laia laia laia

Parece que às vezes vivo de mentiras
Atrás de ilusões que não tem nada a ver
Mas sei que sou teu chão, o teu porto seguro
Eu vejo tudo isso e você não vê
(Você não vê)

Eu não ligo pro que os outros falam
Me arrependo só do que não fiz
Nesses casos de amor o coração é quem diz

Eu aceito todas suas crises
E finjo que acredito no que você diz
Pois quando a gente ama eu sou feliz, feliz
Quando a gente ama eu sou
(Quando a gente ama eu sou feliz)

Não sei o que é que falta pra esse amor dar certo
Será que eu errei em te agradar demais?
Eu acho que você não gosta muito disso
Alguém que só te ama não te satisfaz

Amar como eu te amo até que eu não queria
Mas o que eu vou fazer se não tem solução?
Brincar com quem te gosta assim é covardia
Faz bem só pro seu ego e mal pro coração
(Faz bem só pro seu ego e mal pro meu coração)

Laia laia laia, laia laia laia
Laia laia laia, laia laia laia

Parece que às vezes vivo de mentiras
Atrás de ilusões que não tem nada a ver
Mas sei que sou teu chão, o teu porto seguro
Eu vejo tudo isso e você não vê
(Você não vê)

Eu não ligo pro que os outros falam
Me arrependo só do que não fiz
Nesses casos de amor o coração é quem diz

Eu aceito todas suas crises
E finjo que acredito no que você diz
Pois quando a gente ama eu sou o homem mais feliz
Pois quando a gente ama eu sou feliz, feliz

Laia laia laia, laia laia laia
Eu sou o homem mais feliz
Laia laia laia, laia laia laia
Quando a gente ama

Laia laia laia, laia laia laia
Eu sou o homem mais feliz
Laia laia laia, laia laia laia
Quando a gente ama

Laia laia laia, laia laia laia
Eu sou o homem mais feliz
Laia laia laia, laia laia laia
Quando a gente ama"
"Anna Júlia","Los Hermanos","Quem te vê passar assim por mim
Não sabe o que é sofrer
Ter que ver você, assim, sempre tão linda
Contemplar o Sol do teu olhar, perder você no ar
Na certeza de um amor
Me achar um nada
Pois sem ter teu carinho
Eu me sinto sozinho
Eu me afogo em solidão

Oh, Anna Júlia
Oh, Anna Júlia

Nunca acreditei na ilusão de ter você pra mim
Me atormenta a previsão do nosso destino
Eu passando o dia a te esperar
Você sem me notar
Quando tudo tiver fim, você vai estar com um cara
Um alguém sem carinho
Será sempre um espinho
Dentro do meu coração

Oh, Anna Júlia
Oh, Anna Júlia

Sei que você já não quer o meu amor
Sei que você já não gosta de mim
Eu sei que eu não sou quem você sempre sonhou
Mas vou reconquistar o seu amor todo pra mim

Oh, Anna Júlia
Oh, Anna Júlia
Oh, Anna Júlia
Oh, Anna Júlia, Júlia, Júlia"
"Indecisão","Netinho","Não dá pra viver sem você pois a solidão já machucou demais

Quando o coração tem algo a lhe dizer é melhor deixar rolarvoltar atrás
Você pode não perceber que meu sentimento é puro e verdadeiro

Mas agora diz o que eu posso fazer pra você se entregar de corpointeiro
Sempre quis ter um amor amigo não ter mais que esconder segredo
Acabar com todo esse castigo que não cansa de ferir meu peito
Sua indecisão não faz sentido pois só vivo pra lhe dar prazer
Amar é mais que um bom motivo pra gente se entender
Meu bem diz que me ama
Vem ficar comigo a noite inteira (Diz que me ama)

Curte essa paixão tão verdadeira (Diz que me ama)
Infeliz de quem não sabe amar

Meu bem diz que me ama

Abre o coração, diz a verdade (Diz que me ama)

Tudo em busca de felicidade (Diz que me ama)
O que é bom pra mim, bom pra você"
